{
  "status": "PHASE_0B_COMPLETE",
  "threat_actor": {
    "name": "AMBERSQUID",
    "aliases": [],
    "motivation": "financial - cryptocurrency mining",
    "attribution_country": "Indonesia",
    "tools_used": [
      "SRBMiner-MULTI",
      "UPX",
      "Docker",
      "AWS CLI",
      "Git"
    ]
  },
  "platform": "aws",
  "targeted_services": [
    "AWS Amplify",
    "Amazon ECS",
    "AWS Fargate",
    "Amazon SageMaker",
    "AWS CodeCommit",
    "AWS CodeBuild",
    "AWS CloudFormation",
    "EC2 Auto Scaling",
    "EC2 Image Builder",
    "AWS Glue"
  ],
  "kill_chain_order": [
    "T1583.001",
    "T1608.001",
    "T1204.003",
    "T1078.004",
    "T1136.003",
    "T1098.001",
    "T1059.009",
    "T1525",
    "T1580",
    "T1610",
    "T1578.002",
    "T1070",
    "T1496"
  ],
  "credential_chain": [
    {
      "phase": 3,
      "source": "victim AWS credentials passed as container environment variables",
      "source_technique": "T1204.003",
      "credential_type": "AWS access key + secret",
      "used_in_phases": [
        4,
        5,
        6,
        7,
        8,
        9,
        10,
        11,
        12,
        13
      ],
      "expiration": "long-lived"
    },
    {
      "phase": 5,
      "source": "IAM role AWSCodeCommit-Role created by attacker",
      "source_technique": "T1136.003",
      "credential_type": "IAM role with Amplify/CodeCommit/CloudWatch full access",
      "used_in_phases": [
        8,
        12
      ],
      "expiration": "indefinite"
    },
    {
      "phase": 5,
      "source": "IAM role sugo-role created by attacker",
      "source_technique": "T1136.003",
      "credential_type": "IAM role with SageMaker full access",
      "used_in_phases": [
        11
      ],
      "expiration": "indefinite"
    },
    {
      "phase": 5,
      "source": "IAM role ecsTaskExecutionRole created by attacker",
      "source_technique": "T1136.003",
      "credential_type": "IAM role with AdministratorAccess and ECS full access",
      "used_in_phases": [
        10
      ],
      "expiration": "indefinite"
    }
  ],
  "iocs": {
    "ip_addresses": [],
    "domains": [
      "master.d19tgz4vpyd5.amplifyapp.com"
    ],
    "file_paths": [
      "entrypoint.sh",
      "amplify-role.sh",
      "repo.sh",
      "code.sh",
      "jalan.sh",
      "sup0.sh",
      "ecs.sh",
      "ulang.sh",
      "note.sh",
      "salah.sh",
      "delete.sh",
      "stoptrigger.sh",
      "scale.sh",
      "restart.sh",
      "amplify.yml",
      "index.py",
      "amplify-role.json",
      "sugo.json",
      "ecsTaskExecutionRole.json"
    ],
    "service_names": [
      "AWSCodeCommit-Role",
      "sugo-role",
      "ecsTaskExecutionRole",
      "task",
      "task1"
    ],
    "tool_names": [
      "SRBMiner-MULTI",
      "UPX",
      "Docker"
    ],
    "exfil_endpoints": [
      "2miners",
      "c3pool",
      "nanopool"
    ],
    "crypto_wallets": [
      "ZEPHYR2vyrpcg2e2sJaA88EM6aGaLCBdiYfiHffrs5b3Fa4p1qpoEPH4UabmhJr5YYF7CxJykLTJmESQWaB9ARNuhb6jvptapVq3v",
      "TFrQ7u9spKk8MBgX6Bze3oxPbs3Yh1tAsq",
      "RNu4dQGeFDSPP5iHthijkfnzgxcW2nPde9",
      "89v8xC6Mu2tX27WZKhefTuSnN7f3JMHQSAuoD7ZRe1bV2wfExSTDZe4JwaM4qpjKAoWbAbbnqLBmGCFECiwnXdfSKHt85H3",
      "8B7ommXjcEpTAHKFFyci1v5ADrqvEbphhHrzbBfJgvqjecbik7vcLonh8rYSstbBxgD8AccrJYEukDaXZB8ns3kTLiXL8BN",
      "837MGitRYxgEV158RDenxVUfb5mN6qzz78Z1WeaDoiqC4K7H8Pj556vHJoVXL2MCJ5WCGVZTBiRmqJFxeJG3WSQmGKhPC31",
      "Q010500bc3733dbd0576ca26a8595d59b577a4d1e09c019856abfa103b8f08ec0ed36735e0e2f35",
      "Q01050074da7be4fe8216f789041227c08ccbf310617362641336e1f282c398937635a5d3ebbdbf",
      "007DE31E4FD8213FBCE3586A3D2260C962142BBC605BB41C41"
    ],
    "user_agents": []
  },
  "operational_notes": {
    "estimated_attack_duration_minutes": 60,
    "inter_call_delay_seconds": [
      1,
      5
    ],
    "inter_phase_delay_seconds": [
      30,
      120
    ],
    "attack_creates_resources": [
      "IAM roles: AWSCodeCommit-Role, sugo-role, ecsTaskExecutionRole",
      "CodeCommit repo 'test' per region (up to 16 regions)",
      "Amplify web apps: 5 per region across 8 regions",
      "CodeBuild projects: 3 per region (small/medium/large)",
      "CloudFormation stacks with EC2 ImageBuilder components per region",
      "EC2 ImageBuilder pipelines: 8 per region (cron every minute)",
      "EC2 Auto Scaling groups: task (on-demand) and task1 (spot), 8 instances each, 4 regions",
      "ECS clusters + Fargate services: up to 30 tasks per region across 16 regions",
      "SageMaker notebook instances: 8x ml.t3.2xlarge across 4 regions"
    ],
    "cannot_safely_emulate": [
      {
        "technique": "T1496",
        "reason": "Real multi-region cryptomining costs ~$10k/day in victim AWS account",
        "simulation": "mock miner binary that sleeps and exits immediately without network connections"
      },
      {
        "technique": "T1578.002",
        "reason": "EC2 Auto Scaling groups and CloudFormation stacks with real instance types incur immediate AWS charges",
        "simulation": "dry-run CreateLaunchTemplate and describe-quota calls only"
      },
      {
        "technique": "T1610",
        "reason": "Launching ECS Fargate services with desiredCount 30 across 16 regions creates massive compute charges",
        "simulation": "register task definition only, do not create service"
      },
      {
        "technique": "T1525",
        "reason": "Pushing miner binaries to CodeCommit requires victim AWS account with real credentials",
        "simulation": "create empty CodeCommit repo without pushing malicious content"
      }
    ]
  },
  "source_url": "https://www.sysdig.com/blog/ambersquid",
  "extraction_confidence": "high"
}