{
  "status": "PHASE_0B_COMPLETE",
  "threat_actor": {
    "name": "SCARLETEEL 2.0",
    "aliases": [
      "SCARLETEEL",
      "SCARLETEEL 2.0"
    ],
    "motivation": "Financial — cryptomining revenue (XMRig + Pandora/Mirai DDoS botnet); intellectual property theft (Lambda source code, environment variables, Secrets Manager credentials); lateral movement for persistent access",
    "attribution_country": "Unknown",
    "tools_used": [
      "XMRig (cryptominer)",
      "Pandora (Mirai variant DDoS bot)",
      "Pacu (AWS attack framework — recon phase)",
      "curl (credential theft, exfiltration)",
      "AWS CLI (inside compromised container)",
      "boto3 (attack orchestration)",
      "/dev/tcp (shell built-in exfiltration)"
    ]
  },
  "platform": "aws",
  "targeted_services": [
    "EC2",
    "IAM",
    "S3",
    "Lambda",
    "CloudTrail",
    "SecretsManager",
    "IMDS (Instance Metadata Service)"
  ],
  "kill_chain_order": [
    "T1190",
    "T1552.005",
    "T1496",
    "T1048",
    "T1526",
    "T1078.004",
    "T1098.001",
    "T1530",
    "T1005",
    "T1562.008",
    "T1552.001",
    "T1528"
  ],
  "credential_chain": [
    {
      "phase": 1,
      "source": "IMDSv1 credential theft from inside vulnerable Docker container via command injection in Flask app",
      "source_technique": "T1552.005",
      "credential_type": "AWS EC2 instance role temporary credentials (AssumedRole) with IAM/S3/Lambda/CloudTrail/SecretsManager permissions",
      "used_in_phases": [2, 3, 4, 5, 6],
      "expiration": "short-term (~6 hours, not renewable from attacker perspective)"
    },
    {
      "phase": 5,
      "source": "terraform.tfstate file stored in S3 bucket scarleteel-tf-state-*",
      "source_technique": "T1552.001",
      "credential_type": "AWS IAM long-term access key (AKIA*) for zero-permission bait user",
      "used_in_phases": [6],
      "expiration": "long-term (no expiry)"
    }
  ],
  "iocs": {
    "ip_addresses": [
      "45.9.148.221 (SCARLETEEL primary C2 server)",
      "175.102.182.6 (SCARLETEEL secondary C2 / script hosting)",
      "5.39.93.71 (termbin exfiltration endpoint, port 9999)",
      "223.233.87.167 (attacker source IP observed in emulation run)"
    ],
    "domains": [
      "hb.bizmrg.com (Russian S3-compatible endpoint — used for CloudTrail-evading exfiltration)",
      "pool.c3pool.com (XMRig mining pool, port 13333)"
    ],
    "file_paths": [
      "/tmp/miner.sh",
      "/tmp/config_background.json",
      "/tmp/aws_stolen/raw.json",
      "/tmp/aws_stolen/configure_stolen.sh",
      "/root/.configure/containerd (miner binary disguised as containerd)",
      "/root/.configure/pandora (Pandora/Mirai DDoS bot)",
      "containered.service (systemd service — note extra 'e' — masquerades as containerd)"
    ],
    "service_names": [],
    "tool_names": [
      "XMRig (simulated)",
      "Pandora/Mirai (simulated)",
      "Pacu",
      "curl",
      "AWS CLI",
      "boto3"
    ],
    "exfil_endpoints": [
      "pool.c3pool.com:13333 (XMRig mining pool)",
      "hb.bizmrg.com (Russian S3 endpoint — zero CloudTrail events in victim account)",
      "5.39.93.71:9999 (termbin)"
    ],
    "crypto_wallets": [
      "43Lfq18TycJHVR3AMews5C9f6SEfenZoQMcrsEeFXZTWcFW9jW7VeCySDm1L9n4d2JEoHjcDpWZFq6QzqN4QGHYZVaALj3U (Monero wallet)"
    ],
    "user_agents": [
      "Boto3/<version> Python/<version> (attacker-side orchestration)"
    ]
  },
  "operational_notes": {
    "estimated_attack_duration_minutes": 7,
    "inter_call_delay_seconds": [2, 6],
    "inter_phase_delay_seconds": [5, 15],
    "attack_creates_resources": [
      "XMRig miner files in /tmp/ on compromised container host",
      "Pandora bot files in /root/.configure/ (simulated)",
      "containered.service systemd unit (simulated)",
      "IAM CreateUser: ScarleteelBackdoor (created then deleted in Phase 2)",
      "IAM CreateAccessKey attempts on adminJoe and AdminJoe (AdminJoe bypass test)"
    ],
    "cannot_safely_emulate": [
      {
        "technique": "T1496 — Actual XMRig cryptomining",
        "reason": "Running a real cryptominer consumes compute resources and may violate AWS ToS",
        "simulation": "Deploy XMRig configuration files and Pandora simulation scripts that print simulated output"
      },
      {
        "technique": "T1048 — /dev/tcp exfiltration to real C2 (45.9.148.221, 175.102.182.6)",
        "reason": "Sending credentials to real attacker infrastructure is illegal and harmful",
        "simulation": "Log the exfiltration command to /tmp/exfil_sim.log with IOC documentation"
      },
      {
        "technique": "S3 exfiltration via Russian S3 endpoint (hb.bizmrg.com)",
        "reason": "Sending victim data to a real foreign endpoint constitutes actual data exfiltration",
        "simulation": "Document the --endpoint-url technique and explain that it bypasses CloudTrail in the victim account"
      }
    ]
  },
  "source_url": "https://sysdig.com/blog/scarleteel-2-0/",
  "extraction_confidence": "high"
}
