{
  "status": "PHASE_0B_COMPLETE",
  "threat_actor": {
    "name": "SCARLETEEL",
    "aliases": [
      "SCARLETEEL"
    ],
    "motivation": "Financial — cryptomining revenue via resource hijacking; intellectual property theft (Lambda source code, environment variables); lateral movement for expanded access",
    "attribution_country": "Unknown",
    "tools_used": [
      "XMRig (cryptominer)",
      "curl / wget",
      "AWS CLI (inside compromised container)",
      "boto3 (attack orchestration)"
    ]
  },
  "platform": "aws",
  "targeted_services": [
    "EC2",
    "IAM",
    "S3",
    "Lambda",
    "CloudTrail",
    "IMDS (Instance Metadata Service)"
  ],
  "kill_chain_order": [
    "T1190",
    "T1552.005",
    "T1496",
    "T1078.004",
    "T1526",
    "T1530",
    "T1005",
    "T1562.008",
    "T1552.001"
  ],
  "credential_chain": [
    {
      "phase": 1,
      "source": "IMDSv1 credential theft from inside vulnerable Docker container via command injection in Flask app",
      "source_technique": "T1552.005",
      "credential_type": "AWS EC2 instance role temporary credentials (AssumedRole)",
      "used_in_phases": [2, 3, 4, 5],
      "expiration": "short-term (~6 hours, not renewable from attacker perspective)"
    },
    {
      "phase": 5,
      "source": "terraform.tfstate file stored in S3 bucket scarleteel-tf-state-*",
      "source_technique": "T1552.001",
      "credential_type": "AWS IAM long-term access key (AKIA*) for zero-permission bait user",
      "used_in_phases": [6],
      "expiration": "long-term (no expiry)"
    }
  ],
  "iocs": {
    "ip_addresses": [
      "223.233.84.57 (attacker source IP observed in emulation run)"
    ],
    "domains": [],
    "file_paths": [
      "/tmp/miner.sh",
      "/tmp/config_background.json",
      "/tmp/aws_stolen/raw.json",
      "/tmp/aws_stolen/configure_stolen.sh"
    ],
    "service_names": [],
    "tool_names": [
      "XMRig (simulated)",
      "curl",
      "wget",
      "AWS CLI",
      "boto3"
    ],
    "exfil_endpoints": [
      "pool.example.com:3333 (simulated XMRig mining pool)"
    ],
    "crypto_wallets": [
      "wallet_placeholder (simulated)"
    ],
    "user_agents": [
      "Boto3/<version> Python/<version> (attacker-side orchestration)"
    ]
  },
  "operational_notes": {
    "estimated_attack_duration_minutes": 2,
    "inter_call_delay_seconds": [0, 2],
    "inter_phase_delay_seconds": [0, 5],
    "attack_creates_resources": [
      "XMRig miner files in /tmp/ on compromised container host",
      "IAM CreateUser attempt (ScarleteelBackdoor) — expected to fail via role policy",
      "IAM CreateAccessKey attempt (AdminJoe) — expected to fail via role policy"
    ],
    "cannot_safely_emulate": [
      {
        "technique": "T1496 — Actual XMRig cryptomining",
        "reason": "Running a real cryptominer consumes compute resources and may violate AWS ToS",
        "simulation": "Deploy XMRig configuration files and a mock shell script that prints simulated output"
      },
      {
        "technique": "T1048 — /dev/tcp exfiltration to real C2",
        "reason": "Sending credentials to real attacker infrastructure is illegal and harmful",
        "simulation": "Log the exfiltration command to /tmp/exfil_sim.log with comment explaining the real technique"
      }
    ]
  },
  "source_url": "https://sysdig.com/blog/cloud-breach-scarleteel/",
  "extraction_confidence": "high"
}
