{
  "status": "PHASE_0B_COMPLETE",
  "threat_actor": {
    "name": "LUCR-3",
    "aliases": [
      "Scattered Spider",
      "Oktapus",
      "UNC3944",
      "STORM-0875"
    ],
    "motivation": "Financial extortion via IP theft; demands in tens of millions USD",
    "attribution_country": "unknown",
    "tools_used": [
      "S3 Browser 10.9.9",
      "AWS CloudShell",
      "AWS Management Console",
      "web browser",
      "SCCM",
      "GitHub",
      "GitLab"
    ]
  },
  "platform": "multi_cloud",
  "targeted_services": [
    "Okta",
    "Azure AD",
    "Entra ID",
    "PingOne",
    "SharePoint",
    "OneDrive",
    "GitHub",
    "GitLab",
    "AWS S3",
    "AWS EC2",
    "AWS SSM",
    "AWS SecretsManager",
    "AWS GuardDuty",
    "AWS CloudTrail",
    "AWS CloudShell",
    "Amazon DynamoDB",
    "Amazon RDS",
    "M365",
    "Google Workspace",
    "Terraform Vault",
    "SCCM"
  ],
  "kill_chain_order": [
    "T1078.004",
    "T1621",
    "T1111",
    "T1098.005",
    "T1213.002",
    "T1580",
    "T1619",
    "T1082",
    "T1098",
    "T1136.003",
    "T1098.001",
    "T1555.006",
    "T1578.002",
    "T1550.001",
    "T1562.001",
    "T1562.008",
    "T1021.004",
    "T1072",
    "T1070.008",
    "T1530",
    "T1213.003"
  ],
  "credential_chain": [
    {
      "phase": 1,
      "source": "deepweb marketplace / smishing / social engineering helpdesk",
      "source_technique": "T1078.004",
      "credential_type": "IDP username and password",
      "used_in_phases": [
        1,
        2,
        3,
        4,
        5,
        6
      ],
      "expiration": "static until rotated"
    },
    {
      "phase": 3,
      "source": "IDP session after MFA bypass with registered attacker device",
      "source_technique": "T1098.005",
      "credential_type": "IDP session token / persistent enrolled factor",
      "used_in_phases": [
        4,
        5,
        6,
        7,
        8,
        9
      ],
      "expiration": "persistent via registered device"
    },
    {
      "phase": 8,
      "source": "IAM CreateAccessKey on new or existing user",
      "source_technique": "T1098.001",
      "credential_type": "AWS long-lived access key",
      "used_in_phases": [
        9,
        10,
        11,
        12,
        13,
        14,
        15
      ],
      "expiration": "non-expiring until rotated"
    },
    {
      "phase": 9,
      "source": "AWS SecretsManager / Terraform Vault scrape via CloudShell",
      "source_technique": "T1555.006",
      "credential_type": "third-party API keys, partner credentials, client credentials",
      "used_in_phases": [
        10,
        11,
        12,
        13
      ],
      "expiration": "varies per secret"
    },
    {
      "phase": 11,
      "source": "GitHub/GitLab token generation via SaaS UI or API",
      "source_technique": "T1550.001",
      "credential_type": "CI/CD personal access token",
      "used_in_phases": [
        13,
        14
      ],
      "expiration": "long-lived or no expiry"
    }
  ],
  "iocs": {
    "ip_addresses": [],
    "domains": [],
    "file_paths": [],
    "service_names": [
      "Okta",
      "Azure AD",
      "Entra ID",
      "PingOne",
      "SharePoint",
      "OneDrive",
      "GitHub",
      "GitLab",
      "AWS SecretsManager",
      "AWS GuardDuty",
      "AWS CloudTrail",
      "AWS SSM",
      "AWS S3",
      "SCCM",
      "Terraform Vault"
    ],
    "tool_names": [
      "S3 Browser 10.9.9",
      "AWS CloudShell",
      "SCCM",
      "BlackCat ransomware"
    ],
    "exfil_endpoints": [],
    "crypto_wallets": [],
    "user_agents": [
      "S3 Browser 10.9.9"
    ]
  },
  "operational_notes": {
    "estimated_attack_duration_minutes": 4320,
    "inter_call_delay_seconds": [
      30,
      300
    ],
    "inter_phase_delay_seconds": [
      3600,
      86400
    ],
    "attack_creates_resources": [
      "IAM User",
      "IAM Access Key",
      "EC2 instance",
      "IAM instance profile",
      "CloudShell environment",
      "GitHub/GitLab access token"
    ],
    "cannot_safely_emulate": [
      {
        "technique": "T1111",
        "reason": "SIM swapping is illegal telecom fraud",
        "simulation": "Simulate OTP interception with a mock TOTP server"
      },
      {
        "technique": "T1078.004",
        "reason": "Purchasing credentials from darkweb marketplaces is illegal",
        "simulation": "Use pre-seeded test credentials in a sandbox IDP"
      },
      {
        "technique": "T1555.006",
        "reason": "Scraping real production SecretsManager exposes live credentials",
        "simulation": "Populate sandbox SecretsManager with synthetic secrets"
      },
      {
        "technique": "T1072",
        "reason": "SCCM lateral movement requires domain-joined endpoints and may disrupt production",
        "simulation": "Demonstrate SCCM query enumeration only in isolated lab domain"
      }
    ]
  },
  "source_url": "https://permiso.io/blog/lucr-3-scattered-spider-getting-saas-y-in-the-cloud",
  "extraction_confidence": "high"
}